{
  "actors": [
    {
      "actorId": "owner",
      "goal": "Owner gives a bot a display name",
      "name": "owner"
    }
  ],
  "contractId": "studio-name-bot",
  "outOfScope": [],
  "preconditions": [],
  "promises": [
    {
      "maxEvidenceAgeSeconds": 604800,
      "promiseId": "run.visible",
      "requiredEvidenceKinds": [
        "visual_capture"
      ],
      "requiredFact": "content_rendered",
      "requiredObserverCapability": "browser",
      "statement": "shows region \"Team\", button \"Name this bot\", heading \"planner asks\"",
      "statesToObserve": [
        "stable"
      ],
      "stepId": "run"
    },
    {
      "maxEvidenceAgeSeconds": 604800,
      "promiseId": "naming.visible",
      "requiredEvidenceKinds": [
        "visual_capture"
      ],
      "requiredFact": "content_rendered",
      "requiredObserverCapability": "browser",
      "statement": "shows textbox \"Name for planner\", button \"Save\", button \"Cancel\"",
      "statesToObserve": [
        "stable"
      ],
      "stepId": "naming"
    },
    {
      "maxEvidenceAgeSeconds": 604800,
      "promiseId": "named.visible",
      "requiredEvidenceKinds": [
        "visual_capture"
      ],
      "requiredFact": "content_rendered",
      "requiredObserverCapability": "browser",
      "statement": "shows region \"Team\", button \"Move Planny\"",
      "statesToObserve": [
        "success"
      ],
      "stepId": "named"
    }
  ],
  "riskSignals": [
    "critical_ux"
  ],
  "steps": [
    {
      "actorId": "owner",
      "expectedStates": [
        "stable"
      ],
      "failureContract": {
        "prohibitedSideEffects": [],
        "recoveryAction": null,
        "safeStop": "stop replay",
        "timeoutSeconds": 30,
        "visibleError": "screen run not reached"
      },
      "screen": {
        "scopePaths": [
          "apps/studio/src/App.tsx",
          "apps/studio/src/components/team-canvas.tsx",
          "apps/studio/src/runtime/team.ts"
        ],
        "screenId": "run",
        "title": "A run is open: rail, chat, team canvas, side panel"
      },
      "semanticAction": {
        "kind": "navigate",
        "target": {
          "geometryClaim": false,
          "strategy": "label",
          "value": "/?session=studio-fixture"
        }
      },
      "stepId": "run"
    },
    {
      "actorId": "owner",
      "expectedStates": [
        "stable"
      ],
      "failureContract": {
        "prohibitedSideEffects": [],
        "recoveryAction": null,
        "safeStop": "stop replay",
        "timeoutSeconds": 30,
        "visibleError": "screen naming not reached"
      },
      "screen": {
        "scopePaths": [
          "apps/studio/src/components/team-canvas.tsx"
        ],
        "screenId": "naming",
        "title": "Inline name form under the bot"
      },
      "semanticAction": {
        "kind": "activate",
        "target": {
          "geometryClaim": false,
          "role": "button",
          "strategy": "accessible_name",
          "value": "Name this bot"
        }
      },
      "stepId": "naming"
    },
    {
      "actorId": "owner",
      "expectedStates": [
        "success"
      ],
      "failureContract": {
        "prohibitedSideEffects": [],
        "recoveryAction": null,
        "safeStop": "stop replay",
        "timeoutSeconds": 30,
        "visibleError": "screen named not reached"
      },
      "screen": {
        "scopePaths": [
          "apps/studio/src/App.tsx",
          "apps/studio/src/components/team-canvas.tsx",
          "apps/studio/src/runtime/team.ts",
          "apps/studio/src/components/beacon.tsx"
        ],
        "screenId": "named",
        "title": "The alias is recorded; the bot reads by its new name (demo: Planny)"
      },
      "semanticAction": {
        "kind": "submit",
        "target": {
          "geometryClaim": false,
          "role": "button",
          "strategy": "accessible_name",
          "value": "Save"
        }
      },
      "stepId": "named"
    }
  ],
  "taskScope": "journey-flow studio-name-bot path main",
  "title": "Owner gives a bot a display name",
  "version": 1
}
