{
  "actors": [
    {
      "actorId": "owner",
      "goal": "Owner opens Models and the Add model form",
      "name": "owner"
    }
  ],
  "contractId": "studio-models",
  "outOfScope": [],
  "preconditions": [],
  "promises": [
    {
      "maxEvidenceAgeSeconds": 604800,
      "promiseId": "run.visible",
      "requiredEvidenceKinds": [
        "visual_capture"
      ],
      "requiredFact": "content_rendered",
      "requiredObserverCapability": "browser",
      "statement": "shows navigation \"Projects\", button \"models\"",
      "statesToObserve": [
        "stable"
      ],
      "stepId": "run"
    },
    {
      "maxEvidenceAgeSeconds": 604800,
      "promiseId": "models.visible",
      "requiredEvidenceKinds": [
        "visual_capture"
      ],
      "requiredFact": "content_rendered",
      "requiredObserverCapability": "browser",
      "statement": "shows region \"Models\", heading \"Models\", button \"Add model\", button \"Close models\"",
      "statesToObserve": [
        "stable"
      ],
      "stepId": "models"
    },
    {
      "maxEvidenceAgeSeconds": 604800,
      "promiseId": "edit-route.visible",
      "requiredEvidenceKinds": [
        "visual_capture"
      ],
      "requiredFact": "content_rendered",
      "requiredObserverCapability": "browser",
      "statement": "shows form \"Edit route\", textbox \"Route id\", combobox \"Wire format\", textbox \"Base URL\", textbox \"Model\", checkbox \"Enabled\", button \"apply\", button \"cancel\"",
      "statesToObserve": [
        "stable"
      ],
      "stepId": "edit-route"
    }
  ],
  "riskSignals": [
    "security",
    "authentication"
  ],
  "steps": [
    {
      "actorId": "owner",
      "expectedStates": [
        "stable"
      ],
      "failureContract": {
        "prohibitedSideEffects": [],
        "recoveryAction": null,
        "safeStop": "stop replay",
        "timeoutSeconds": 30,
        "visibleError": "screen run not reached"
      },
      "screen": {
        "scopePaths": [
          "apps/studio/src/App.tsx",
          "apps/studio/src/components/rail.tsx"
        ],
        "screenId": "run",
        "title": "A run is open: rail, chat, team canvas, side panel"
      },
      "semanticAction": {
        "kind": "navigate",
        "target": {
          "geometryClaim": false,
          "strategy": "label",
          "value": "/"
        }
      },
      "stepId": "run"
    },
    {
      "actorId": "owner",
      "expectedStates": [
        "stable"
      ],
      "failureContract": {
        "prohibitedSideEffects": [],
        "recoveryAction": null,
        "safeStop": "stop replay",
        "timeoutSeconds": 30,
        "visibleError": "screen models not reached"
      },
      "screen": {
        "scopePaths": [
          "apps/studio/src/App.tsx",
          "apps/studio/src/components/models.tsx",
          "apps/studio/src/runtime/client.ts"
        ],
        "screenId": "models",
        "title": "Models panel: routes, probes, Add model"
      },
      "semanticAction": {
        "kind": "activate",
        "target": {
          "geometryClaim": false,
          "role": "button",
          "strategy": "accessible_name",
          "value": "models"
        }
      },
      "stepId": "models"
    },
    {
      "actorId": "owner",
      "expectedStates": [
        "stable"
      ],
      "failureContract": {
        "prohibitedSideEffects": [],
        "recoveryAction": null,
        "safeStop": "stop replay",
        "timeoutSeconds": 30,
        "visibleError": "screen edit-route not reached"
      },
      "screen": {
        "scopePaths": [
          "apps/studio/src/components/models.tsx"
        ],
        "screenId": "edit-route",
        "title": "Edit route form for a new model"
      },
      "semanticAction": {
        "kind": "activate",
        "target": {
          "geometryClaim": false,
          "role": "button",
          "strategy": "accessible_name",
          "value": "Add model"
        }
      },
      "stepId": "edit-route"
    }
  ],
  "taskScope": "journey-flow studio-models path main",
  "title": "Owner opens Models and the Add model form",
  "version": 1
}
